Toys - Walmart.com,https://www.walmart.com/cp/toys/4171,Shop for Toys at Walmart.com and browse Bikes, Dolls, Dollhouses, Drones, 
Action Figures, Learning Toys and Remote Control Toys. Save money. Live 
better."
Toys & Games - Amazon.com,https://www.amazon.com/toys/b?ie=UTF8&node=165793011,Amazon Toys & Games. About Amazon Toys & Games: Amazon's Toys & Games 
store features thousands of products, including dolls, action figures, games and ..."
Toys : Target,https://www.target.com/c/toys/-/N-5xtb0,Shop Target for toys for all ages--everything from dolls and action figures to 
board games and crafts. Free shipping & free returns."
